[I 2026-03-01 22:34:39,701] Trial 73 finished with value: 0.4420791149139404 and parameters: {'n_layers': 2, 'hidden_dim': 32, 'dropout': 0.2, 'activation': 'SiLU', 'lr': 0.006585992348832259, 'weight_decay': 0.0004018699371985486, 'batch_size': 16}. Best is trial 33 with value: 0.43868049383163454.
[I 2026-03-01 22:34:40,794] Trial 74 finished with value: 0.4403757631778717 and parameters: {'n_layers': 2, 'hidden_dim': 32, 'dropout': 0.2, 'activation': 'SiLU', 'lr': 0.008605895052259444, 'weight_decay': 0.0008281270430526885, 'batch_size': 16}. Best is trial 33 with value: 0.43868049383163454.
[I 2026-03-01 22:34:41,974] Trial 75 finished with value: 0.4416679680347443 and parameters: {'n_layers': 2, 'hidden_dim': 32, 'dropout': 0.2, 'activation': 'SiLU', 'lr': 0.009405129058859377, 'weight_decay': 0.0011031628978838076, 'batch_size': 16}. Best is trial 33 with value: 0.43868049383163454.
[I 2026-03-01 22:34:43,164] Trial 76 finished with value: 0.45113383531570433 and parameters: {'n_layers': 2, 'hidden_dim': 64, 'dropout': 0.1, 'activation': 'SiLU', 'lr': 0.009206548317544446, 'weight_decay': 0.0010627380627323407, 'batch_size': 16}. Best is trial 33 with value: 0.43868049383163454.
[I 2026-03-01 22:34:44,478] Trial 77 finished with value: 0.46294382214546204 and parameters: {'n_layers': 2, 'hidden_dim': 8, 'dropout': 0.2, 'activation': 'SiLU', 'lr': 0.008635292307939918, 'weight_decay': 0.0015683788284553864, 'batch_size': 16}. Best is trial 33 with value: 0.43868049383163454.
[I 2026-03-01 22:34:45,668] Trial 78 finished with value: 0.44484357833862304 and parameters: {'n_layers': 2, 'hidden_dim': 32, 'dropout': 0.30000000000000004, 'activation': 'SiLU', 'lr': 0.006865374673775485, 'weight_decay': 0.0008023018807184738, 'batch_size': 16}. Best is trial 33 with value: 0.43868049383163454.
[I 2026-03-01 22:34:47,124] Trial 79 finished with value: 0.44489735960960386 and parameters: {'n_layers': 2, 'hidden_dim': 16, 'dropout': 0.2, 'activation': 'SiLU', 'lr': 0.00964080098903499, 'weight_decay': 0.0021359953832819282, 'batch_size': 16}. Best is trial 33 with value: 0.43868049383163454.
[I 2026-03-01 22:34:48,510] Trial 80 finished with value: 0.46741547584533694 and parameters: {'n_layers': 2, 'hidden_dim': 32, 'dropout': 0.4, 'activation': 'LeakyReLU', 'lr': 0.008009996624303512, 'weight_decay': 0.00127475680716082, 'batch_size': 16}. Best is trial 33 with value: 0.43868049383163454.
[I 2026-03-01 22:34:50,054] Trial 81 finished with value: 0.4429996371269226 and parameters: {'n_layers': 2, 'hidden_dim': 32, 'dropout': 0.2, 'activation': 'SiLU', 'lr': 0.006325870808040831, 'weight_decay': 0.0005482251511038109, 'batch_size': 16}. Best is trial 33 with value: 0.43868049383163454.
[I 2026-03-01 22:34:51,796] Trial 82 finished with value: 0.4481506943702698 and parameters: {'n_layers': 2, 'hidden_dim': 32, 'dropout': 0.2, 'activation': 'SiLU', 'lr': 0.004142454198071467, 'weight_decay': 0.0008575306875340355, 'batch_size': 16}. Best is trial 33 with value: 0.43868049383163454.
[I 2026-03-01 22:34:53,097] Trial 83 finished with value: 0.446423864364624 and parameters: {'n_layers': 2, 'hidden_dim': 32, 'dropout': 0.2, 'activation': 'SiLU', 'lr': 0.007016097567072731, 'weight_decay': 0.0011206870438909614, 'batch_size': 16}. Best is trial 33 with value: 0.43868049383163454.
[I 2026-03-01 22:34:54,333] Trial 84 finished with value: 0.4444330036640167 and parameters: {'n_layers': 2, 'hidden_dim': 32, 'dropout': 0.2, 'activation': 'SiLU', 'lr': 0.009937971291317684, 'weight_decay': 0.0004451526666135173, 'batch_size': 16}. Best is trial 33 with value: 0.43868049383163454.
[I 2026-03-01 22:34:55,657] Trial 85 finished with value: 0.4457406342029572 and parameters: {'n_layers': 2, 'hidden_dim': 32, 'dropout': 0.2, 'activation': 'SiLU', 'lr': 0.0031608776481717475, 'weight_decay': 0.004696549655004761, 'batch_size': 16}. Best is trial 33 with value: 0.43868049383163454.
[I 2026-03-01 22:34:56,780] Trial 86 finished with value: 0.44059497117996216 and parameters: {'n_layers': 2, 'hidden_dim': 32, 'dropout': 0.30000000000000004, 'activation': 'SiLU', 'lr': 0.007517390402448697, 'weight_decay': 0.0005605259603858578, 'batch_size': 16}. Best is trial 33 with value: 0.43868049383163454.
[I 2026-03-01 22:34:58,269] Trial 87 finished with value: 0.4450344443321228 and parameters: {'n_layers': 2, 'hidden_dim': 32, 'dropout': 0.30000000000000004, 'activation': 'Tanh', 'lr': 0.008738297603657758, 'weight_decay': 0.000739682339096726, 'batch_size': 16}. Best is trial 33 with value: 0.43868049383163454.
[I 2026-03-01 22:34:59,628] Trial 88 finished with value: 0.4735037565231323 and parameters: {'n_layers': 3, 'hidden_dim': 32, 'dropout': 0.30000000000000004, 'activation': 'ReLU', 'lr': 0.0077769984546870626, 'weight_decay': 0.0005920940033975809, 'batch_size': 16}. Best is trial 33 with value: 0.43868049383163454.
[I 2026-03-01 22:35:00,969] Trial 89 finished with value: 0.44214807748794555 and parameters: {'n_layers': 2, 'hidden_dim': 32, 'dropout': 0.4, 'activation': 'SiLU', 'lr': 0.006405538991052091, 'weight_decay': 0.0005219147139472791, 'batch_size': 16}. Best is trial 33 with value: 0.43868049383163454.
[I 2026-03-01 22:35:02,158] Trial 90 finished with value: 0.4454701662063599 and parameters: {'n_layers': 2, 'hidden_dim': 32, 'dropout': 0.30000000000000004, 'activation': 'SiLU', 'lr': 0.006599629395287746, 'weight_decay': 0.0003593565883976998, 'batch_size': 16}. Best is trial 33 with value: 0.43868049383163454.
[I 2026-03-01 22:35:03,577] Trial 91 finished with value: 0.44215354323387146 and parameters: {'n_layers': 2, 'hidden_dim': 32, 'dropout': 0.4, 'activation': 'SiLU', 'lr': 0.005164949420058595, 'weight_decay': 0.0005243288701273334, 'batch_size': 16}. Best is trial 33 with value: 0.43868049383163454.
[I 2026-03-01 22:35:05,024] Trial 92 finished with value: 0.44213140606880186 and parameters: {'n_layers': 2, 'hidden_dim': 32, 'dropout': 0.4, 'activation': 'SiLU', 'lr': 0.005148819819344989, 'weight_decay': 0.0005233633717291546, 'batch_size': 16}. Best is trial 33 with value: 0.43868049383163454.
[I 2026-03-01 22:35:06,528] Trial 93 finished with value: 0.4427084863185883 and parameters: {'n_layers': 2, 'hidden_dim': 32, 'dropout': 0.4, 'activation': 'SiLU', 'lr': 0.006029874350474191, 'weight_decay': 0.0005350795844278714, 'batch_size': 16}. Best is trial 33 with value: 0.43868049383163454.
[I 2026-03-01 22:35:07,761] Trial 94 finished with value: 0.44278275966644287 and parameters: {'n_layers': 2, 'hidden_dim': 32, 'dropout': 0.4, 'activation': 'SiLU', 'lr': 0.007188380199090896, 'weight_decay': 0.0004174975874613549, 'batch_size': 16}. Best is trial 33 with value: 0.43868049383163454.
[I 2026-03-01 22:35:09,309] Trial 95 finished with value: 0.44222883582115174 and parameters: {'n_layers': 2, 'hidden_dim': 32, 'dropout': 0.4, 'activation': 'SiLU', 'lr': 0.004396353876896692, 'weight_decay': 0.0005231784559517205, 'batch_size': 16}. Best is trial 33 with value: 0.43868049383163454.
[I 2026-03-01 22:35:10,967] Trial 96 finished with value: 0.4966318249702454 and parameters: {'n_layers': 2, 'hidden_dim': 8, 'dropout': 0.4, 'activation': 'SiLU', 'lr': 0.0050407327132057445, 'weight_decay': 0.0003209804260508237, 'batch_size': 16}. Best is trial 33 with value: 0.43868049383163454.
[I 2026-03-01 22:35:12,357] Trial 97 finished with value: 0.44379868507385256 and parameters: {'n_layers': 2, 'hidden_dim': 32, 'dropout': 0.5, 'activation': 'SiLU', 'lr': 0.008901300586171272, 'weight_decay': 0.0006816790535436709, 'batch_size': 16}. Best is trial 33 with value: 0.43868049383163454.
[I 2026-03-01 22:35:14,111] Trial 98 finished with value: 0.45917436480522156 and parameters: {'n_layers': 2, 'hidden_dim': 16, 'dropout': 0.4, 'activation': 'SiLU', 'lr': 0.007725308969087841, 'weight_decay': 0.000844514095856131, 'batch_size': 16}. Best is trial 33 with value: 0.43868049383163454.
[I 2026-03-01 22:35:15,413] Trial 99 finished with value: 0.44124471545219424 and parameters: {'n_layers': 2, 'hidden_dim': 32, 'dropout': 0.4, 'activation': 'SiLU', 'lr': 0.005910448302715437, 'weight_decay': 0.0010665698687433729, 'batch_size': 16}. Best is trial 33 with value: 0.43868049383163454.
[I 2026-03-01 22:35:17,006] Trial 100 finished with value: 0.43428086638450625 and parameters: {'n_layers': 2, 'hidden_dim': 64, 'dropout': 0.4, 'activation': 'Tanh', 'lr': 0.0062867341492347595, 'weight_decay': 0.001064272879984357, 'batch_size': 16}. Best is trial 100 with value: 0.43428086638450625.
[I 2026-03-01 22:35:18,647] Trial 101 finished with value: 0.43712485432624815 and parameters: {'n_layers': 2, 'hidden_dim': 64, 'dropout': 0.4, 'activation': 'Tanh', 'lr': 0.006653792680364116, 'weight_decay': 0.0014413646019969513, 'batch_size': 16}. Best is trial 100 with value: 0.43428086638450625.
[I 2026-03-01 22:35:23,278] Trial 102 finished with value: 0.4716888010501862 and parameters: {'n_layers': 2, 'hidden_dim': 64, 'dropout': 0.4, 'activation': 'Tanh', 'lr': 0.00010003381350082386, 'weight_decay': 0.001532576284540758, 'batch_size': 16}. Best is trial 100 with value: 0.43428086638450625.
[I 2026-03-01 22:35:24,816] Trial 103 finished with value: 0.43499351739883424 and parameters: {'n_layers': 2, 'hidden_dim': 64, 'dropout': 0.4, 'activation': 'Tanh', 'lr': 0.0060173395475633, 'weight_decay': 0.0012639882163578897, 'batch_size': 16}. Best is trial 100 with value: 0.43428086638450625.
[I 2026-03-01 22:35:26,628] Trial 104 finished with value: 0.4205270349979401 and parameters: {'n_layers': 2, 'hidden_dim': 64, 'dropout': 0.5, 'activation': 'Tanh', 'lr': 0.007569777210295408, 'weight_decay': 0.0031384743245333837, 'batch_size': 16}. Best is trial 104 with value: 0.4205270349979401.
[I 2026-03-01 22:35:28,220] Trial 105 finished with value: 0.42462568879127505 and parameters: {'n_layers': 2, 'hidden_dim': 64, 'dropout': 0.5, 'activation': 'Tanh', 'lr': 0.007665343279474526, 'weight_decay': 0.0026628162140860706, 'batch_size': 16}. Best is trial 104 with value: 0.4205270349979401.
[I 2026-03-01 22:35:29,142] Trial 106 finished with value: 0.4511299192905426 and parameters: {'n_layers': 2, 'hidden_dim': 64, 'dropout': 0.5, 'activation': 'Tanh', 'lr': 0.005844313838825944, 'weight_decay': 0.003813535052850443, 'batch_size': 32}. Best is trial 104 with value: 0.4205270349979401.
[I 2026-03-01 22:35:31,505] Trial 107 finished with value: 0.4231062471866608 and parameters: {'n_layers': 2, 'hidden_dim': 64, 'dropout': 0.5, 'activation': 'Tanh', 'lr': 0.00786809023609844, 'weight_decay': 0.002815200966764226, 'batch_size': 16}. Best is trial 104 with value: 0.4205270349979401.
[I 2026-03-01 22:35:33,392] Trial 108 finished with value: 0.4282226026058197 and parameters: {'n_layers': 2, 'hidden_dim': 64, 'dropout': 0.5, 'activation': 'Tanh', 'lr': 0.007080065399641117, 'weight_decay': 0.003515764871619639, 'batch_size': 16}. Best is trial 104 with value: 0.4205270349979401.
[I 2026-03-01 22:35:35,014] Trial 109 finished with value: 0.42039047479629515 and parameters: {'n_layers': 2, 'hidden_dim': 64, 'dropout': 0.5, 'activation': 'Tanh', 'lr': 0.00750241084135729, 'weight_decay': 0.0028027860434103736, 'batch_size': 16}. Best is trial 109 with value: 0.42039047479629515.
[I 2026-03-01 22:35:36,538] Trial 110 finished with value: 0.4238207936286926 and parameters: {'n_layers': 2, 'hidden_dim': 64, 'dropout': 0.5, 'activation': 'Tanh', 'lr': 0.007413274633558164, 'weight_decay': 0.0031786674399091534, 'batch_size': 16}. Best is trial 109 with value: 0.42039047479629515.
[I 2026-03-01 22:35:38,063] Trial 111 finished with value: 0.42465059757232665 and parameters: {'n_layers': 2, 'hidden_dim': 64, 'dropout': 0.5, 'activation': 'Tanh', 'lr': 0.0075005423551903734, 'weight_decay': 0.0035880744995858607, 'batch_size': 16}. Best is trial 109 with value: 0.42039047479629515.
[I 2026-03-01 22:35:39,808] Trial 112 finished with value: 0.4282799124717712 and parameters: {'n_layers': 2, 'hidden_dim': 64, 'dropout': 0.5, 'activation': 'Tanh', 'lr': 0.0070875622620140116, 'weight_decay': 0.0030810294487754078, 'batch_size': 16}. Best is trial 109 with value: 0.42039047479629515.
[I 2026-03-01 22:35:41,349] Trial 113 finished with value: 0.427541184425354 and parameters: {'n_layers': 2, 'hidden_dim': 64, 'dropout': 0.5, 'activation': 'Tanh', 'lr': 0.00709851536187587, 'weight_decay': 0.0031889798275937333, 'batch_size': 16}. Best is trial 109 with value: 0.42039047479629515.
[I 2026-03-01 22:35:43,021] Trial 114 finished with value: 0.42434335947036744 and parameters: {'n_layers': 2, 'hidden_dim': 64, 'dropout': 0.5, 'activation': 'Tanh', 'lr': 0.007371675488748302, 'weight_decay': 0.0031428625757970257, 'batch_size': 16}. Best is trial 109 with value: 0.42039047479629515.
[I 2026-03-01 22:35:44,703] Trial 115 finished with value: 0.42596942782402036 and parameters: {'n_layers': 2, 'hidden_dim': 64, 'dropout': 0.5, 'activation': 'Tanh', 'lr': 0.007219188019560439, 'weight_decay': 0.0031367795915808972, 'batch_size': 16}. Best is trial 109 with value: 0.42039047479629515.
[I 2026-03-01 22:35:46,468] Trial 116 finished with value: 0.42278668880462644 and parameters: {'n_layers': 2, 'hidden_dim': 64, 'dropout': 0.5, 'activation': 'Tanh', 'lr': 0.0075375887422126095, 'weight_decay': 0.0031670257555509794, 'batch_size': 16}. Best is trial 109 with value: 0.42039047479629515.
[I 2026-03-01 22:35:48,244] Trial 117 finished with value: 0.421408599615097 and parameters: {'n_layers': 2, 'hidden_dim': 64, 'dropout': 0.5, 'activation': 'Tanh', 'lr': 0.007463915676810521, 'weight_decay': 0.003069433138458943, 'batch_size': 16}. Best is trial 109 with value: 0.42039047479629515.
[I 2026-03-01 22:35:50,012] Trial 118 finished with value: 0.4238780617713928 and parameters: {'n_layers': 2, 'hidden_dim': 64, 'dropout': 0.5, 'activation': 'Tanh', 'lr': 0.007570094165546332, 'weight_decay': 0.006678093764041099, 'batch_size': 16}. Best is trial 109 with value: 0.42039047479629515.
[I 2026-03-01 22:35:51,599] Trial 119 finished with value: 0.4624190330505371 and parameters: {'n_layers': 2, 'hidden_dim': 64, 'dropout': 0.5, 'activation': 'Tanh', 'lr': 0.0008537524728488178, 'weight_decay': 0.00634990677165808, 'batch_size': 16}. Best is trial 109 with value: 0.42039047479629515.
[I 2026-03-01 22:35:53,159] Trial 120 finished with value: 0.4262105166912079 and parameters: {'n_layers': 2, 'hidden_dim': 64, 'dropout': 0.5, 'activation': 'Tanh', 'lr': 0.007835000163820134, 'weight_decay': 0.0024219429103068475, 'batch_size': 16}. Best is trial 109 with value: 0.42039047479629515.
[I 2026-03-01 22:35:54,909] Trial 121 finished with value: 0.42269269824028016 and parameters: {'n_layers': 2, 'hidden_dim': 64, 'dropout': 0.5, 'activation': 'Tanh', 'lr': 0.007705026491721085, 'weight_decay': 0.0026177756773322447, 'batch_size': 16}. Best is trial 109 with value: 0.42039047479629515.
[I 2026-03-01 22:35:56,577] Trial 122 finished with value: 0.42336984872817995 and parameters: {'n_layers': 2, 'hidden_dim': 64, 'dropout': 0.5, 'activation': 'Tanh', 'lr': 0.007918829032738491, 'weight_decay': 0.0025095185343300564, 'batch_size': 16}. Best is trial 109 with value: 0.42039047479629515.
[I 2026-03-01 22:35:58,300] Trial 123 finished with value: 0.4260538101196289 and parameters: {'n_layers': 2, 'hidden_dim': 64, 'dropout': 0.5, 'activation': 'Tanh', 'lr': 0.009919746521153308, 'weight_decay': 0.004256270180795658, 'batch_size': 16}. Best is trial 109 with value: 0.42039047479629515.
[I 2026-03-01 22:36:00,050] Trial 124 finished with value: 0.4227395713329315 and parameters: {'n_layers': 2, 'hidden_dim': 64, 'dropout': 0.5, 'activation': 'Tanh', 'lr': 0.009125786806297912, 'weight_decay': 0.005936821161413844, 'batch_size': 16}. Best is trial 109 with value: 0.42039047479629515.
[I 2026-03-01 22:36:01,739] Trial 125 finished with value: 0.42211496233940127 and parameters: {'n_layers': 2, 'hidden_dim': 64, 'dropout': 0.5, 'activation': 'Tanh', 'lr': 0.00933255261395657, 'weight_decay': 0.006464456237492704, 'batch_size': 16}. Best is trial 109 with value: 0.42039047479629515.
[I 2026-03-01 22:36:03,273] Trial 126 finished with value: 0.421130633354187 and parameters: {'n_layers': 2, 'hidden_dim': 64, 'dropout': 0.5, 'activation': 'Tanh', 'lr': 0.008555395004494357, 'weight_decay': 0.006334437196832189, 'batch_size': 16}. Best is trial 109 with value: 0.42039047479629515.
[I 2026-03-01 22:36:04,758] Trial 127 finished with value: 0.42473445534706117 and parameters: {'n_layers': 2, 'hidden_dim': 64, 'dropout': 0.5, 'activation': 'Tanh', 'lr': 0.00890966911742336, 'weight_decay': 0.006881441639737588, 'batch_size': 16}. Best is trial 109 with value: 0.42039047479629515.
[I 2026-03-01 22:36:05,967] Trial 128 finished with value: 0.4421768426895142 and parameters: {'n_layers': 2, 'hidden_dim': 64, 'dropout': 0.5, 'activation': 'Tanh', 'lr': 0.00932083651174861, 'weight_decay': 0.005860068961728714, 'batch_size': 32}. Best is trial 109 with value: 0.42039047479629515.
[I 2026-03-01 22:36:07,418] Trial 129 finished with value: 0.4251939594745636 and parameters: {'n_layers': 2, 'hidden_dim': 64, 'dropout': 0.5, 'activation': 'Tanh', 'lr': 0.008262569017600361, 'weight_decay': 0.008205548824704085, 'batch_size': 16}. Best is trial 109 with value: 0.42039047479629515.
[I 2026-03-01 22:36:09,061] Trial 130 finished with value: 0.42100846767425537 and parameters: {'n_layers': 2, 'hidden_dim': 64, 'dropout': 0.5, 'activation': 'Tanh', 'lr': 0.009152968927621793, 'weight_decay': 0.00482864034630553, 'batch_size': 16}. Best is trial 109 with value: 0.42039047479629515.
[I 2026-03-01 22:36:10,620] Trial 131 finished with value: 0.42317959666252136 and parameters: {'n_layers': 2, 'hidden_dim': 64, 'dropout': 0.5, 'activation': 'Tanh', 'lr': 0.008799431973094367, 'weight_decay': 0.004948644924605882, 'batch_size': 16}. Best is trial 109 with value: 0.42039047479629515.
[I 2026-03-01 22:36:12,265] Trial 132 finished with value: 0.4266544759273529 and parameters: {'n_layers': 2, 'hidden_dim': 64, 'dropout': 0.5, 'activation': 'Tanh', 'lr': 0.009113727033771554, 'weight_decay': 0.004929135514042223, 'batch_size': 16}. Best is trial 109 with value: 0.42039047479629515.
[I 2026-03-01 22:36:13,987] Trial 133 finished with value: 0.4209760785102844 and parameters: {'n_layers': 2, 'hidden_dim': 64, 'dropout': 0.5, 'activation': 'Tanh', 'lr': 0.008311290544744217, 'weight_decay': 0.005644646258529829, 'batch_size': 16}. Best is trial 109 with value: 0.42039047479629515.
[I 2026-03-01 22:36:15,366] Trial 134 finished with value: 0.42806872725486755 and parameters: {'n_layers': 2, 'hidden_dim': 64, 'dropout': 0.5, 'activation': 'Tanh', 'lr': 0.00994781290699219, 'weight_decay': 0.0043330187805391, 'batch_size': 16}. Best is trial 109 with value: 0.42039047479629515.
[I 2026-03-01 22:36:17,069] Trial 135 finished with value: 0.4274669706821442 and parameters: {'n_layers': 2, 'hidden_dim': 64, 'dropout': 0.5, 'activation': 'Tanh', 'lr': 0.008414864919915005, 'weight_decay': 0.002154662383539866, 'batch_size': 16}. Best is trial 109 with value: 0.42039047479629515.
[I 2026-03-01 22:36:18,676] Trial 136 finished with value: 0.42203163504600527 and parameters: {'n_layers': 2, 'hidden_dim': 64, 'dropout': 0.5, 'activation': 'Tanh', 'lr': 0.009038898769438664, 'weight_decay': 0.007407351661530819, 'batch_size': 16}. Best is trial 109 with value: 0.42039047479629515.
[I 2026-03-01 22:36:20,506] Trial 137 finished with value: 0.4183869779109955 and parameters: {'n_layers': 2, 'hidden_dim': 64, 'dropout': 0.5, 'activation': 'Tanh', 'lr': 0.008851978024608369, 'weight_decay': 0.008388033094716418, 'batch_size': 16}. Best is trial 137 with value: 0.4183869779109955.
[I 2026-03-01 22:36:22,282] Trial 138 finished with value: 0.4179228901863098 and parameters: {'n_layers': 2, 'hidden_dim': 64, 'dropout': 0.5, 'activation': 'Tanh', 'lr': 0.008687814755717569, 'weight_decay': 0.008219458769912608, 'batch_size': 16}. Best is trial 138 with value: 0.4179228901863098.
[I 2026-03-01 22:36:23,956] Trial 139 finished with value: 0.4199922800064087 and parameters: {'n_layers': 2, 'hidden_dim': 64, 'dropout': 0.5, 'activation': 'Tanh', 'lr': 0.009240016646215703, 'weight_decay': 0.00831028064055395, 'batch_size': 16}. Best is trial 138 with value: 0.4179228901863098.
[I 2026-03-01 22:36:25,463] Trial 140 finished with value: 0.42512211203575134 and parameters: {'n_layers': 2, 'hidden_dim': 64, 'dropout': 0.5, 'activation': 'Tanh', 'lr': 0.009241989770605322, 'weight_decay': 0.00997712178415994, 'batch_size': 16}. Best is trial 138 with value: 0.4179228901863098.
[I 2026-03-01 22:36:27,178] Trial 141 finished with value: 0.4277603566646576 and parameters: {'n_layers': 2, 'hidden_dim': 64, 'dropout': 0.5, 'activation': 'Tanh', 'lr': 0.009973260915424909, 'weight_decay': 0.007625177786948375, 'batch_size': 16}. Best is trial 138 with value: 0.4179228901863098.
[I 2026-03-01 22:36:30,514] Trial 142 finished with value: 0.46942084431648257 and parameters: {'n_layers': 2, 'hidden_dim': 64, 'dropout': 0.5, 'activation': 'Tanh', 'lr': 0.00018809268196155667, 'weight_decay': 0.005721597047638068, 'batch_size': 16}. Best is trial 138 with value: 0.4179228901863098.
[I 2026-03-01 22:36:32,364] Trial 143 finished with value: 0.4244485557079315 and parameters: {'n_layers': 2, 'hidden_dim': 64, 'dropout': 0.5, 'activation': 'Tanh', 'lr': 0.008669739844672708, 'weight_decay': 0.008154091109404495, 'batch_size': 16}. Best is trial 138 with value: 0.4179228901863098.
[I 2026-03-01 22:36:34,764] Trial 144 finished with value: 0.4688593089580536 and parameters: {'n_layers': 2, 'hidden_dim': 64, 'dropout': 0.5, 'activation': 'Tanh', 'lr': 0.00033327841681468385, 'weight_decay': 0.008402962478699287, 'batch_size': 16}. Best is trial 138 with value: 0.4179228901863098.
