Train: 141,  Test: 34
Features: 9,  Targets: 3
Optuna trials: 200,  CV folds: 5

[I 2026-03-01 22:32:15,230] Trial 0 finished with value: 0.5281655192375183 and parameters: {'n_layers': 1, 'hidden_dim': 8, 'dropout': 0.0, 'activation': 'LeakyReLU', 'lr': 0.00010994335574766199, 'weight_decay': 0.008123245085588688, 'batch_size': 8}. Best is trial 0 with value: 0.5281655192375183.
[I 2026-03-01 22:32:17,638] Trial 1 finished with value: 0.48814722895622253 and parameters: {'n_layers': 0, 'lr': 0.0004059611610484307, 'weight_decay': 0.00037520558551242813, 'batch_size': 32}. Best is trial 1 with value: 0.48814722895622253.
[I 2026-03-01 22:32:21,541] Trial 2 finished with value: 0.4831160008907318 and parameters: {'n_layers': 0, 'lr': 0.0003839629299804173, 'weight_decay': 0.00012562773503807024, 'batch_size': 16}. Best is trial 2 with value: 0.4831160008907318.
[I 2026-03-01 22:32:23,585] Trial 3 finished with value: 0.49928976893424987 and parameters: {'n_layers': 2, 'hidden_dim': 32, 'dropout': 0.0, 'activation': 'LeakyReLU', 'lr': 0.0001567993391672301, 'weight_decay': 0.0011290133559092666, 'batch_size': 32}. Best is trial 2 with value: 0.4831160008907318.
[I 2026-03-01 22:32:24,626] Trial 4 finished with value: 0.4610432207584381 and parameters: {'n_layers': 0, 'lr': 0.006586289317583112, 'weight_decay': 5.9750279999602906e-05, 'batch_size': 8}. Best is trial 4 with value: 0.4610432207584381.
[I 2026-03-01 22:32:34,508] Trial 5 finished with value: 0.6088848948478699 and parameters: {'n_layers': 2, 'hidden_dim': 16, 'dropout': 0.5, 'activation': 'LeakyReLU', 'lr': 0.00012315571723666037, 'weight_decay': 9.46217535646148e-05, 'batch_size': 32}. Best is trial 4 with value: 0.4610432207584381.
[I 2026-03-01 22:32:35,419] Trial 6 finished with value: 0.487232905626297 and parameters: {'n_layers': 1, 'hidden_dim': 64, 'dropout': 0.0, 'activation': 'ReLU', 'lr': 0.004274869455295219, 'weight_decay': 0.001319994226153501, 'batch_size': 16}. Best is trial 4 with value: 0.4610432207584381.
[I 2026-03-01 22:32:36,001] Trial 7 finished with value: 0.507300055027008 and parameters: {'n_layers': 1, 'hidden_dim': 16, 'dropout': 0.0, 'activation': 'SiLU', 'lr': 0.0059487468132197715, 'weight_decay': 0.00026100256506134784, 'batch_size': 32}. Best is trial 4 with value: 0.4610432207584381.
[I 2026-03-01 22:32:37,111] Trial 8 finished with value: 0.5038102209568024 and parameters: {'n_layers': 2, 'hidden_dim': 8, 'dropout': 0.0, 'activation': 'SiLU', 'lr': 0.0010402587615883842, 'weight_decay': 0.005280796376895365, 'batch_size': 32}. Best is trial 4 with value: 0.4610432207584381.
[I 2026-03-01 22:32:43,596] Trial 9 finished with value: 0.49143635034561156 and parameters: {'n_layers': 0, 'lr': 0.00014254757044027455, 'weight_decay': 7.40038575908737e-05, 'batch_size': 16}. Best is trial 4 with value: 0.4610432207584381.
[I 2026-03-01 22:32:45,888] Trial 10 finished with value: 0.45904096961021423 and parameters: {'n_layers': 3, 'hidden_dim': 64, 'dropout': 0.30000000000000004, 'activation': 'Tanh', 'lr': 0.002399730081077603, 'weight_decay': 1.3066991237906973e-05, 'batch_size': 8}. Best is trial 10 with value: 0.45904096961021423.
[I 2026-03-01 22:32:48,210] Trial 11 finished with value: 0.45855486392974854 and parameters: {'n_layers': 3, 'hidden_dim': 64, 'dropout': 0.30000000000000004, 'activation': 'Tanh', 'lr': 0.0024792013326598596, 'weight_decay': 1.2594581093948296e-05, 'batch_size': 8}. Best is trial 11 with value: 0.45855486392974854.
[I 2026-03-01 22:32:50,464] Trial 12 finished with value: 0.45812581181526185 and parameters: {'n_layers': 3, 'hidden_dim': 64, 'dropout': 0.30000000000000004, 'activation': 'Tanh', 'lr': 0.0025537162437252793, 'weight_decay': 1.0268906322884046e-05, 'batch_size': 8}. Best is trial 12 with value: 0.45812581181526185.
[I 2026-03-01 22:32:53,073] Trial 13 finished with value: 0.46043562293052676 and parameters: {'n_layers': 3, 'hidden_dim': 64, 'dropout': 0.30000000000000004, 'activation': 'Tanh', 'lr': 0.0016123406099647285, 'weight_decay': 1.0216376326662009e-05, 'batch_size': 8}. Best is trial 12 with value: 0.45812581181526185.
[I 2026-03-01 22:32:55,624] Trial 14 finished with value: 0.45374587178230286 and parameters: {'n_layers': 3, 'hidden_dim': 64, 'dropout': 0.2, 'activation': 'Tanh', 'lr': 0.0027799351514297636, 'weight_decay': 2.835793642078295e-05, 'batch_size': 8}. Best is trial 14 with value: 0.45374587178230286.
[I 2026-03-01 22:32:59,078] Trial 15 finished with value: 0.4469000220298767 and parameters: {'n_layers': 3, 'hidden_dim': 64, 'dropout': 0.2, 'activation': 'Tanh', 'lr': 0.009818247569037463, 'weight_decay': 3.3948989892735294e-05, 'batch_size': 8}. Best is trial 15 with value: 0.4469000220298767.
[I 2026-03-01 22:33:00,770] Trial 16 finished with value: 0.4457269787788391 and parameters: {'n_layers': 2, 'hidden_dim': 32, 'dropout': 0.2, 'activation': 'Tanh', 'lr': 0.00980068818378313, 'weight_decay': 3.146939321009493e-05, 'batch_size': 8}. Best is trial 16 with value: 0.4457269787788391.
[I 2026-03-01 22:33:02,545] Trial 17 finished with value: 0.45774654746055604 and parameters: {'n_layers': 2, 'hidden_dim': 32, 'dropout': 0.2, 'activation': 'ReLU', 'lr': 0.009006020499939725, 'weight_decay': 3.464432951063626e-05, 'batch_size': 8}. Best is trial 16 with value: 0.4457269787788391.
[I 2026-03-01 22:33:04,712] Trial 18 finished with value: 0.4457791209220886 and parameters: {'n_layers': 2, 'hidden_dim': 32, 'dropout': 0.1, 'activation': 'Tanh', 'lr': 0.009614242897818186, 'weight_decay': 3.30158758877725e-05, 'batch_size': 8}. Best is trial 16 with value: 0.4457269787788391.
[I 2026-03-01 22:33:06,561] Trial 19 finished with value: 0.4481623947620392 and parameters: {'n_layers': 2, 'hidden_dim': 32, 'dropout': 0.1, 'activation': 'Tanh', 'lr': 0.004566626956923251, 'weight_decay': 0.00022356581726723347, 'batch_size': 8}. Best is trial 16 with value: 0.4457269787788391.
[I 2026-03-01 22:33:07,747] Trial 20 finished with value: 0.4832470536231995 and parameters: {'n_layers': 1, 'hidden_dim': 32, 'dropout': 0.1, 'activation': 'Tanh', 'lr': 0.0005675340745421171, 'weight_decay': 2.4214448786961924e-05, 'batch_size': 16}. Best is trial 16 with value: 0.4457269787788391.
[I 2026-03-01 22:33:09,420] Trial 21 finished with value: 0.4456376552581787 and parameters: {'n_layers': 2, 'hidden_dim': 32, 'dropout': 0.2, 'activation': 'Tanh', 'lr': 0.00988708296334769, 'weight_decay': 4.9756159142435e-05, 'batch_size': 8}. Best is trial 21 with value: 0.4456376552581787.
[I 2026-03-01 22:33:11,203] Trial 22 finished with value: 0.4486605882644653 and parameters: {'n_layers': 2, 'hidden_dim': 32, 'dropout': 0.1, 'activation': 'Tanh', 'lr': 0.009938245269011041, 'weight_decay': 4.855419490492811e-05, 'batch_size': 8}. Best is trial 21 with value: 0.4456376552581787.
[I 2026-03-01 22:33:13,923] Trial 23 finished with value: 0.45591957569122316 and parameters: {'n_layers': 2, 'hidden_dim': 32, 'dropout': 0.4, 'activation': 'Tanh', 'lr': 0.00435885666375601, 'weight_decay': 0.0001368820609877496, 'batch_size': 8}. Best is trial 21 with value: 0.4456376552581787.
[I 2026-03-01 22:33:16,228] Trial 24 finished with value: 0.4646327555179596 and parameters: {'n_layers': 2, 'hidden_dim': 32, 'dropout': 0.1, 'activation': 'ReLU', 'lr': 0.006109386560969405, 'weight_decay': 2.3015652238710963e-05, 'batch_size': 8}. Best is trial 21 with value: 0.4456376552581787.
[I 2026-03-01 22:33:17,637] Trial 25 finished with value: 0.4439723312854767 and parameters: {'n_layers': 1, 'hidden_dim': 32, 'dropout': 0.2, 'activation': 'SiLU', 'lr': 0.007435641936722313, 'weight_decay': 0.0006114291219721592, 'batch_size': 8}. Best is trial 25 with value: 0.4439723312854767.
[I 2026-03-01 22:33:19,007] Trial 26 finished with value: 0.4473089396953583 and parameters: {'n_layers': 1, 'hidden_dim': 32, 'dropout': 0.2, 'activation': 'SiLU', 'lr': 0.006609733459657526, 'weight_decay': 0.000540473493444913, 'batch_size': 8}. Best is trial 25 with value: 0.4439723312854767.
[I 2026-03-01 22:33:20,582] Trial 27 finished with value: 0.45395503044128416 and parameters: {'n_layers': 1, 'hidden_dim': 32, 'dropout': 0.4, 'activation': 'SiLU', 'lr': 0.003669865408866851, 'weight_decay': 0.0007638703276604936, 'batch_size': 8}. Best is trial 25 with value: 0.4439723312854767.
[I 2026-03-01 22:33:23,713] Trial 28 finished with value: 0.47436792850494386 and parameters: {'n_layers': 1, 'hidden_dim': 8, 'dropout': 0.2, 'activation': 'SiLU', 'lr': 0.0013558013656389926, 'weight_decay': 0.0014202132332079551, 'batch_size': 8}. Best is trial 25 with value: 0.4439723312854767.
[I 2026-03-01 22:33:24,991] Trial 29 finished with value: 0.46203450560569764 and parameters: {'n_layers': 1, 'hidden_dim': 16, 'dropout': 0.4, 'activation': 'SiLU', 'lr': 0.007217773171262705, 'weight_decay': 0.0025084113291494554, 'batch_size': 16}. Best is trial 25 with value: 0.4439723312854767.
[I 2026-03-01 22:33:26,922] Trial 30 finished with value: 0.4424395740032196 and parameters: {'n_layers': 2, 'hidden_dim': 32, 'dropout': 0.2, 'activation': 'SiLU', 'lr': 0.00524906207494854, 'weight_decay': 0.00019800952017728847, 'batch_size': 8}. Best is trial 30 with value: 0.4424395740032196.
[I 2026-03-01 22:33:28,806] Trial 31 finished with value: 0.44275847673416135 and parameters: {'n_layers': 2, 'hidden_dim': 32, 'dropout': 0.2, 'activation': 'SiLU', 'lr': 0.005447501845663944, 'weight_decay': 0.00014187252117633787, 'batch_size': 8}. Best is trial 30 with value: 0.4424395740032196.
[I 2026-03-01 22:33:30,663] Trial 32 finished with value: 0.4502756416797638 and parameters: {'n_layers': 2, 'hidden_dim': 32, 'dropout': 0.2, 'activation': 'SiLU', 'lr': 0.0032604805306934988, 'weight_decay': 0.00019414551236428368, 'batch_size': 8}. Best is trial 30 with value: 0.4424395740032196.
[I 2026-03-01 22:33:32,585] Trial 33 finished with value: 0.43868049383163454 and parameters: {'n_layers': 2, 'hidden_dim': 32, 'dropout': 0.30000000000000004, 'activation': 'SiLU', 'lr': 0.005179091839709669, 'weight_decay': 0.0004060206247639283, 'batch_size': 8}. Best is trial 33 with value: 0.43868049383163454.
[I 2026-03-01 22:33:34,084] Trial 34 finished with value: 0.46405099630355834 and parameters: {'n_layers': 1, 'hidden_dim': 8, 'dropout': 0.30000000000000004, 'activation': 'SiLU', 'lr': 0.005326235340654074, 'weight_decay': 0.00038925905884997956, 'batch_size': 8}. Best is trial 33 with value: 0.43868049383163454.
[I 2026-03-01 22:33:34,999] Trial 35 finished with value: 0.4766560971736908 and parameters: {'n_layers': 0, 'lr': 0.0017211258504729434, 'weight_decay': 0.00046169335980078525, 'batch_size': 32}. Best is trial 33 with value: 0.43868049383163454.
[I 2026-03-01 22:33:38,785] Trial 36 finished with value: 0.46179547905921936 and parameters: {'n_layers': 2, 'hidden_dim': 32, 'dropout': 0.30000000000000004, 'activation': 'SiLU', 'lr': 0.00046800910823868025, 'weight_decay': 0.00014642133989061846, 'batch_size': 8}. Best is trial 33 with value: 0.43868049383163454.
[I 2026-03-01 22:33:40,126] Trial 37 finished with value: 0.4427108883857727 and parameters: {'n_layers': 2, 'hidden_dim': 32, 'dropout': 0.4, 'activation': 'SiLU', 'lr': 0.0037222890127230337, 'weight_decay': 0.000741010310286185, 'batch_size': 16}. Best is trial 33 with value: 0.43868049383163454.
[I 2026-03-01 22:33:44,654] Trial 38 finished with value: 0.5145062625408172 and parameters: {'n_layers': 2, 'hidden_dim': 32, 'dropout': 0.5, 'activation': 'LeakyReLU', 'lr': 0.00027883569672177967, 'weight_decay': 0.000319574183251235, 'batch_size': 16}. Best is trial 33 with value: 0.43868049383163454.
[I 2026-03-01 22:33:47,064] Trial 39 finished with value: 0.4791836142539978 and parameters: {'n_layers': 2, 'hidden_dim': 16, 'dropout': 0.4, 'activation': 'SiLU', 'lr': 0.0019198243094475252, 'weight_decay': 0.000933069868552254, 'batch_size': 16}. Best is trial 33 with value: 0.43868049383163454.
[I 2026-03-01 22:33:48,462] Trial 40 finished with value: 0.48316152691841124 and parameters: {'n_layers': 2, 'hidden_dim': 32, 'dropout': 0.5, 'activation': 'LeakyReLU', 'lr': 0.003461595596509893, 'weight_decay': 9.217589866652793e-05, 'batch_size': 16}. Best is trial 33 with value: 0.43868049383163454.
[I 2026-03-01 22:33:49,346] Trial 41 finished with value: 0.45390633344650266 and parameters: {'n_layers': 1, 'hidden_dim': 32, 'dropout': 0.4, 'activation': 'SiLU', 'lr': 0.005309351314301823, 'weight_decay': 0.0005886221174258123, 'batch_size': 16}. Best is trial 33 with value: 0.43868049383163454.
[I 2026-03-01 22:33:50,095] Trial 42 finished with value: 0.45414315462112426 and parameters: {'n_layers': 2, 'hidden_dim': 32, 'dropout': 0.30000000000000004, 'activation': 'SiLU', 'lr': 0.007118073618306888, 'weight_decay': 0.001763027292023807, 'batch_size': 32}. Best is trial 33 with value: 0.43868049383163454.
[I 2026-03-01 22:33:51,640] Trial 43 finished with value: 0.44443480372428895 and parameters: {'n_layers': 2, 'hidden_dim': 32, 'dropout': 0.2, 'activation': 'SiLU', 'lr': 0.0049008363814586646, 'weight_decay': 0.0006855837929502463, 'batch_size': 16}. Best is trial 33 with value: 0.43868049383163454.
[I 2026-03-01 22:33:52,467] Trial 44 finished with value: 0.4795610666275024 and parameters: {'n_layers': 1, 'hidden_dim': 8, 'dropout': 0.30000000000000004, 'activation': 'SiLU', 'lr': 0.003922501043534169, 'weight_decay': 0.002905243159246816, 'batch_size': 32}. Best is trial 33 with value: 0.43868049383163454.
[I 2026-03-01 22:33:53,773] Trial 45 finished with value: 0.470261812210083 and parameters: {'n_layers': 0, 'lr': 0.003082955308968435, 'weight_decay': 0.00028073744548172863, 'batch_size': 8}. Best is trial 33 with value: 0.43868049383163454.
[I 2026-03-01 22:33:54,931] Trial 46 finished with value: 0.47573110461235046 and parameters: {'n_layers': 3, 'hidden_dim': 16, 'dropout': 0.1, 'activation': 'SiLU', 'lr': 0.00750015792847784, 'weight_decay': 0.0001838231643480432, 'batch_size': 16}. Best is trial 33 with value: 0.43868049383163454.
[I 2026-03-01 22:33:57,171] Trial 47 finished with value: 0.45192127823829653 and parameters: {'n_layers': 2, 'hidden_dim': 32, 'dropout': 0.30000000000000004, 'activation': 'SiLU', 'lr': 0.0022339648839481093, 'weight_decay': 0.00010197037909153525, 'batch_size': 8}. Best is trial 33 with value: 0.43868049383163454.
[I 2026-03-01 22:33:59,657] Trial 48 finished with value: 0.46538215279579165 and parameters: {'n_layers': 2, 'hidden_dim': 32, 'dropout': 0.2, 'activation': 'SiLU', 'lr': 0.0007507133207750794, 'weight_decay': 0.0009779994670753736, 'batch_size': 8}. Best is trial 33 with value: 0.43868049383163454.
[I 2026-03-01 22:34:03,284] Trial 49 finished with value: 0.5153170943260192 and parameters: {'n_layers': 3, 'hidden_dim': 32, 'dropout': 0.4, 'activation': 'ReLU', 'lr': 0.0002343136531527628, 'weight_decay': 0.009825123906848985, 'batch_size': 32}. Best is trial 33 with value: 0.43868049383163454.
[I 2026-03-01 22:34:04,671] Trial 50 finished with value: 0.4501343071460724 and parameters: {'n_layers': 1, 'hidden_dim': 32, 'dropout': 0.30000000000000004, 'activation': 'SiLU', 'lr': 0.005464209889403078, 'weight_decay': 0.0003912717903913139, 'batch_size': 8}. Best is trial 33 with value: 0.43868049383163454.
[I 2026-03-01 22:34:06,309] Trial 51 finished with value: 0.4446468114852905 and parameters: {'n_layers': 2, 'hidden_dim': 32, 'dropout': 0.2, 'activation': 'SiLU', 'lr': 0.004879106582580518, 'weight_decay': 0.0006582690603603302, 'batch_size': 16}. Best is trial 33 with value: 0.43868049383163454.
[I 2026-03-01 22:34:07,205] Trial 52 finished with value: 0.4507570624351501 and parameters: {'n_layers': 2, 'hidden_dim': 32, 'dropout': 0.2, 'activation': 'SiLU', 'lr': 0.007572981064106812, 'weight_decay': 0.0003030497405467392, 'batch_size': 16}. Best is trial 33 with value: 0.43868049383163454.
[I 2026-03-01 22:34:08,563] Trial 53 finished with value: 0.44770572781562806 and parameters: {'n_layers': 2, 'hidden_dim': 32, 'dropout': 0.2, 'activation': 'SiLU', 'lr': 0.00440067637303581, 'weight_decay': 0.000766926855459466, 'batch_size': 16}. Best is trial 33 with value: 0.43868049383163454.
[I 2026-03-01 22:34:09,814] Trial 54 finished with value: 0.46633678674697876 and parameters: {'n_layers': 2, 'hidden_dim': 32, 'dropout': 0.2, 'activation': 'LeakyReLU', 'lr': 0.002814429187779173, 'weight_decay': 0.00046053548904159583, 'batch_size': 16}. Best is trial 33 with value: 0.43868049383163454.
[I 2026-03-01 22:34:10,932] Trial 55 finished with value: 0.45679631233215334 and parameters: {'n_layers': 2, 'hidden_dim': 64, 'dropout': 0.1, 'activation': 'SiLU', 'lr': 0.008189816326241895, 'weight_decay': 0.0012782792394120499, 'batch_size': 16}. Best is trial 33 with value: 0.43868049383163454.
[I 2026-03-01 22:34:13,122] Trial 56 finished with value: 0.4572445094585419 and parameters: {'n_layers': 3, 'hidden_dim': 32, 'dropout': 0.30000000000000004, 'activation': 'SiLU', 'lr': 0.006131898350032305, 'weight_decay': 0.00023771726501127448, 'batch_size': 8}. Best is trial 33 with value: 0.43868049383163454.
[I 2026-03-01 22:34:15,076] Trial 57 finished with value: 0.47419834733009336 and parameters: {'n_layers': 2, 'hidden_dim': 8, 'dropout': 0.2, 'activation': 'SiLU', 'lr': 0.003977777615831734, 'weight_decay': 0.0018235831128815038, 'batch_size': 8}. Best is trial 33 with value: 0.43868049383163454.
[I 2026-03-01 22:34:16,742] Trial 58 finished with value: 0.5209096372127533 and parameters: {'n_layers': 2, 'hidden_dim': 16, 'dropout': 0.1, 'activation': 'ReLU', 'lr': 0.001273300455737803, 'weight_decay': 0.00016061130557962894, 'batch_size': 16}. Best is trial 33 with value: 0.43868049383163454.
[I 2026-03-01 22:34:19,064] Trial 59 finished with value: 0.44886415600776675 and parameters: {'n_layers': 2, 'hidden_dim': 32, 'dropout': 0.5, 'activation': 'SiLU', 'lr': 0.004809489718997241, 'weight_decay': 7.091436237388592e-05, 'batch_size': 8}. Best is trial 33 with value: 0.43868049383163454.
[I 2026-03-01 22:34:21,256] Trial 60 finished with value: 0.4498573184013367 and parameters: {'n_layers': 1, 'hidden_dim': 32, 'dropout': 0.30000000000000004, 'activation': 'SiLU', 'lr': 0.00615535996637395, 'weight_decay': 0.00011124014420604477, 'batch_size': 8}. Best is trial 33 with value: 0.43868049383163454.
[I 2026-03-01 22:34:22,708] Trial 61 finished with value: 0.44706226587295533 and parameters: {'n_layers': 2, 'hidden_dim': 32, 'dropout': 0.2, 'activation': 'SiLU', 'lr': 0.004739826825217432, 'weight_decay': 0.0006431763761928369, 'batch_size': 16}. Best is trial 33 with value: 0.43868049383163454.
[I 2026-03-01 22:34:23,933] Trial 62 finished with value: 0.4411838471889496 and parameters: {'n_layers': 2, 'hidden_dim': 32, 'dropout': 0.2, 'activation': 'SiLU', 'lr': 0.008219311078897439, 'weight_decay': 0.0006921097396670732, 'batch_size': 16}. Best is trial 33 with value: 0.43868049383163454.
[I 2026-03-01 22:34:25,408] Trial 63 finished with value: 0.4465306639671326 and parameters: {'n_layers': 2, 'hidden_dim': 32, 'dropout': 0.2, 'activation': 'SiLU', 'lr': 0.00649898074341791, 'weight_decay': 0.0009285330388585741, 'batch_size': 16}. Best is trial 33 with value: 0.43868049383163454.
[I 2026-03-01 22:34:26,527] Trial 64 finished with value: 0.4414996266365051 and parameters: {'n_layers': 2, 'hidden_dim': 32, 'dropout': 0.2, 'activation': 'SiLU', 'lr': 0.008389807525613953, 'weight_decay': 0.00046950249877233924, 'batch_size': 16}. Best is trial 33 with value: 0.43868049383163454.
[I 2026-03-01 22:34:27,810] Trial 65 finished with value: 0.45615602731704713 and parameters: {'n_layers': 2, 'hidden_dim': 64, 'dropout': 0.1, 'activation': 'SiLU', 'lr': 0.008135298456107583, 'weight_decay': 0.0004977064791304406, 'batch_size': 16}. Best is trial 33 with value: 0.43868049383163454.
[I 2026-03-01 22:34:29,613] Trial 66 finished with value: 0.46864340305328367 and parameters: {'n_layers': 2, 'hidden_dim': 32, 'dropout': 0.2, 'activation': 'LeakyReLU', 'lr': 0.008277790646911953, 'weight_decay': 0.0003419523133069565, 'batch_size': 8}. Best is trial 33 with value: 0.43868049383163454.
[I 2026-03-01 22:34:30,968] Trial 67 finished with value: 0.4444197416305542 and parameters: {'n_layers': 2, 'hidden_dim': 32, 'dropout': 0.2, 'activation': 'SiLU', 'lr': 0.005620326776183638, 'weight_decay': 0.00022775370465963633, 'batch_size': 16}. Best is trial 33 with value: 0.43868049383163454.
[I 2026-03-01 22:34:32,920] Trial 68 finished with value: 0.47410387396812437 and parameters: {'n_layers': 3, 'hidden_dim': 32, 'dropout': 0.1, 'activation': 'ReLU', 'lr': 0.008746564973783021, 'weight_decay': 0.00044494760099247503, 'batch_size': 8}. Best is trial 33 with value: 0.43868049383163454.
[I 2026-03-01 22:34:34,436] Trial 69 finished with value: 0.4488006591796875 and parameters: {'n_layers': 1, 'hidden_dim': 32, 'dropout': 0.30000000000000004, 'activation': 'SiLU', 'lr': 0.006992036824310713, 'weight_decay': 0.00018191533063096748, 'batch_size': 8}. Best is trial 33 with value: 0.43868049383163454.
[I 2026-03-01 22:34:35,346] Trial 70 finished with value: 0.46483790278434756 and parameters: {'n_layers': 2, 'hidden_dim': 32, 'dropout': 0.2, 'activation': 'SiLU', 'lr': 0.003723729428313704, 'weight_decay': 0.00027424234634817075, 'batch_size': 32}. Best is trial 33 with value: 0.43868049383163454.
[I 2026-03-01 22:34:36,821] Trial 71 finished with value: 0.4445689499378204 and parameters: {'n_layers': 2, 'hidden_dim': 32, 'dropout': 0.2, 'activation': 'SiLU', 'lr': 0.005552310873022616, 'weight_decay': 0.00023399503346730813, 'batch_size': 16}. Best is trial 33 with value: 0.43868049383163454.
[I 2026-03-01 22:34:38,391] Trial 72 finished with value: 0.4440244555473328 and parameters: {'n_layers': 2, 'hidden_dim': 32, 'dropout': 0.2, 'activation': 'SiLU', 'lr': 0.0056115515402287855, 'weight_decay': 0.00036753157666302797, 'batch_size': 16}. Best is trial 33 with value: 0.43868049383163454.
