[I 2026-03-01 22:36:36,577] Trial 145 finished with value: 0.4200349569320679 and parameters: {'n_layers': 2, 'hidden_dim': 64, 'dropout': 0.5, 'activation': 'Tanh', 'lr': 0.008081161653728913, 'weight_decay': 0.005545867310977317, 'batch_size': 16}. Best is trial 138 with value: 0.4179228901863098.
[I 2026-03-01 22:36:38,363] Trial 146 finished with value: 0.4197995662689209 and parameters: {'n_layers': 2, 'hidden_dim': 64, 'dropout': 0.5, 'activation': 'Tanh', 'lr': 0.00919697638482383, 'weight_decay': 0.0056720490881373145, 'batch_size': 16}. Best is trial 138 with value: 0.4179228901863098.
[I 2026-03-01 22:36:40,206] Trial 147 finished with value: 0.4152199923992157 and parameters: {'n_layers': 2, 'hidden_dim': 64, 'dropout': 0.5, 'activation': 'Tanh', 'lr': 0.009269584516107958, 'weight_decay': 0.005672939896634824, 'batch_size': 16}. Best is trial 147 with value: 0.4152199923992157.
[I 2026-03-01 22:36:40,906] Trial 148 finished with value: 0.45571706891059877 and parameters: {'n_layers': 0, 'lr': 0.009958391698124323, 'weight_decay': 0.007012352988993428, 'batch_size': 16}. Best is trial 147 with value: 0.4152199923992157.
[I 2026-03-01 22:36:42,621] Trial 149 finished with value: 0.4196636140346527 and parameters: {'n_layers': 2, 'hidden_dim': 64, 'dropout': 0.5, 'activation': 'Tanh', 'lr': 0.008262800141441172, 'weight_decay': 0.0051347204253713395, 'batch_size': 16}. Best is trial 147 with value: 0.4152199923992157.
[I 2026-03-01 22:36:43,690] Trial 150 finished with value: 0.4427743494510651 and parameters: {'n_layers': 2, 'hidden_dim': 64, 'dropout': 0.5, 'activation': 'Tanh', 'lr': 0.008515683395152712, 'weight_decay': 0.0054948660047563136, 'batch_size': 32}. Best is trial 147 with value: 0.4152199923992157.
[I 2026-03-01 22:36:45,349] Trial 151 finished with value: 0.4149248242378235 and parameters: {'n_layers': 2, 'hidden_dim': 64, 'dropout': 0.5, 'activation': 'Tanh', 'lr': 0.00831608810326909, 'weight_decay': 0.004335006601375103, 'batch_size': 16}. Best is trial 151 with value: 0.4149248242378235.
[I 2026-03-01 22:36:46,910] Trial 152 finished with value: 0.42471364736557005 and parameters: {'n_layers': 2, 'hidden_dim': 64, 'dropout': 0.5, 'activation': 'Tanh', 'lr': 0.008329481923465618, 'weight_decay': 0.009088928901483339, 'batch_size': 16}. Best is trial 151 with value: 0.4149248242378235.
[I 2026-03-01 22:36:48,572] Trial 153 finished with value: 0.42502585649490354 and parameters: {'n_layers': 2, 'hidden_dim': 64, 'dropout': 0.5, 'activation': 'Tanh', 'lr': 0.009269643364108023, 'weight_decay': 0.004230240667087157, 'batch_size': 16}. Best is trial 151 with value: 0.4149248242378235.
[I 2026-03-01 22:36:50,189] Trial 154 finished with value: 0.4288463115692139 and parameters: {'n_layers': 2, 'hidden_dim': 64, 'dropout': 0.5, 'activation': 'Tanh', 'lr': 0.006736196482153086, 'weight_decay': 0.0075045791160451665, 'batch_size': 16}. Best is trial 151 with value: 0.4149248242378235.
[I 2026-03-01 22:36:51,891] Trial 155 finished with value: 0.4236034631729126 and parameters: {'n_layers': 2, 'hidden_dim': 64, 'dropout': 0.5, 'activation': 'Tanh', 'lr': 0.008721465608305728, 'weight_decay': 0.005211754270540633, 'batch_size': 16}. Best is trial 151 with value: 0.4149248242378235.
[I 2026-03-01 22:36:53,424] Trial 156 finished with value: 0.4257895290851593 and parameters: {'n_layers': 2, 'hidden_dim': 64, 'dropout': 0.5, 'activation': 'Tanh', 'lr': 0.008265577015792435, 'weight_decay': 0.006317445223347176, 'batch_size': 16}. Best is trial 151 with value: 0.4149248242378235.
[I 2026-03-01 22:36:54,995] Trial 157 finished with value: 0.4296325445175171 and parameters: {'n_layers': 2, 'hidden_dim': 64, 'dropout': 0.5, 'activation': 'Tanh', 'lr': 0.0065428853422215515, 'weight_decay': 0.008795277130604228, 'batch_size': 16}. Best is trial 151 with value: 0.4149248242378235.
[I 2026-03-01 22:36:56,549] Trial 158 finished with value: 0.4239468932151794 and parameters: {'n_layers': 2, 'hidden_dim': 64, 'dropout': 0.5, 'activation': 'Tanh', 'lr': 0.00985181682066488, 'weight_decay': 0.003941145218259882, 'batch_size': 16}. Best is trial 151 with value: 0.4149248242378235.
[I 2026-03-01 22:36:58,404] Trial 159 finished with value: 0.46728764176368714 and parameters: {'n_layers': 2, 'hidden_dim': 64, 'dropout': 0.5, 'activation': 'Tanh', 'lr': 0.0005401983753598597, 'weight_decay': 0.00542391027297753, 'batch_size': 16}. Best is trial 151 with value: 0.4149248242378235.
[I 2026-03-01 22:37:00,033] Trial 160 finished with value: 0.4248108327388763 and parameters: {'n_layers': 2, 'hidden_dim': 64, 'dropout': 0.5, 'activation': 'Tanh', 'lr': 0.009122873735014277, 'weight_decay': 0.004645245829233118, 'batch_size': 16}. Best is trial 151 with value: 0.4149248242378235.
[I 2026-03-01 22:37:01,772] Trial 161 finished with value: 0.4242874503135681 and parameters: {'n_layers': 2, 'hidden_dim': 64, 'dropout': 0.5, 'activation': 'Tanh', 'lr': 0.007723412547397611, 'weight_decay': 0.007351880238603233, 'batch_size': 16}. Best is trial 151 with value: 0.4149248242378235.
[I 2026-03-01 22:37:03,502] Trial 162 finished with value: 0.42483457922935486 and parameters: {'n_layers': 2, 'hidden_dim': 64, 'dropout': 0.5, 'activation': 'Tanh', 'lr': 0.008473974813185238, 'weight_decay': 0.006569767543718631, 'batch_size': 16}. Best is trial 151 with value: 0.4149248242378235.
[I 2026-03-01 22:37:05,045] Trial 163 finished with value: 0.4288416862487793 and parameters: {'n_layers': 2, 'hidden_dim': 64, 'dropout': 0.5, 'activation': 'Tanh', 'lr': 0.0067041316568630036, 'weight_decay': 0.003760487736015682, 'batch_size': 16}. Best is trial 151 with value: 0.4149248242378235.
[I 2026-03-01 22:37:06,832] Trial 164 finished with value: 0.41939366459846494 and parameters: {'n_layers': 2, 'hidden_dim': 64, 'dropout': 0.5, 'activation': 'Tanh', 'lr': 0.007866175518627434, 'weight_decay': 0.004875929338166682, 'batch_size': 16}. Best is trial 151 with value: 0.4149248242378235.
[I 2026-03-01 22:37:07,845] Trial 165 finished with value: 0.445453941822052 and parameters: {'n_layers': 2, 'hidden_dim': 64, 'dropout': 0.0, 'activation': 'Tanh', 'lr': 0.008069029142480434, 'weight_decay': 0.0051130740587138875, 'batch_size': 16}. Best is trial 151 with value: 0.4149248242378235.
[I 2026-03-01 22:37:09,131] Trial 166 finished with value: 0.4584421098232269 and parameters: {'n_layers': 2, 'hidden_dim': 64, 'dropout': 0.5, 'activation': 'LeakyReLU', 'lr': 0.009277366648487455, 'weight_decay': 0.005941470885350815, 'batch_size': 16}. Best is trial 151 with value: 0.4149248242378235.
[I 2026-03-01 22:37:10,341] Trial 167 finished with value: 0.4717725157737732 and parameters: {'n_layers': 2, 'hidden_dim': 64, 'dropout': 0.5, 'activation': 'ReLU', 'lr': 0.0066698381569279905, 'weight_decay': 0.004508279664494623, 'batch_size': 16}. Best is trial 151 with value: 0.4149248242378235.
[I 2026-03-01 22:37:12,028] Trial 168 finished with value: 0.4215790927410126 and parameters: {'n_layers': 2, 'hidden_dim': 64, 'dropout': 0.5, 'activation': 'Tanh', 'lr': 0.009939939790951268, 'weight_decay': 0.00956573642510525, 'batch_size': 16}. Best is trial 151 with value: 0.4149248242378235.
[I 2026-03-01 22:37:13,690] Trial 169 finished with value: 0.42370725274085996 and parameters: {'n_layers': 2, 'hidden_dim': 64, 'dropout': 0.5, 'activation': 'Tanh', 'lr': 0.009912548687800093, 'weight_decay': 0.009867592566787556, 'batch_size': 16}. Best is trial 151 with value: 0.4149248242378235.
[I 2026-03-01 22:37:15,961] Trial 170 finished with value: 0.49155591130256654 and parameters: {'n_layers': 2, 'hidden_dim': 8, 'dropout': 0.5, 'activation': 'Tanh', 'lr': 0.008242428110823914, 'weight_decay': 0.007759543852655319, 'batch_size': 16}. Best is trial 151 with value: 0.4149248242378235.
[I 2026-03-01 22:37:17,835] Trial 171 finished with value: 0.4267680585384369 and parameters: {'n_layers': 2, 'hidden_dim': 64, 'dropout': 0.5, 'activation': 'Tanh', 'lr': 0.008972188199393515, 'weight_decay': 0.00655023410977498, 'batch_size': 16}. Best is trial 151 with value: 0.4149248242378235.
[I 2026-03-01 22:37:19,555] Trial 172 finished with value: 0.42549934387207033 and parameters: {'n_layers': 2, 'hidden_dim': 64, 'dropout': 0.5, 'activation': 'Tanh', 'lr': 0.008087821333602816, 'weight_decay': 0.00863073064994072, 'batch_size': 16}. Best is trial 151 with value: 0.4149248242378235.
[I 2026-03-01 22:37:21,171] Trial 173 finished with value: 0.42791818380355834 and parameters: {'n_layers': 2, 'hidden_dim': 64, 'dropout': 0.5, 'activation': 'Tanh', 'lr': 0.0071756725832963966, 'weight_decay': 0.0070999987315213745, 'batch_size': 16}. Best is trial 151 with value: 0.4149248242378235.
[I 2026-03-01 22:37:22,964] Trial 174 finished with value: 0.4295180320739746 and parameters: {'n_layers': 2, 'hidden_dim': 64, 'dropout': 0.5, 'activation': 'Tanh', 'lr': 0.009958387244665811, 'weight_decay': 0.005487964008254982, 'batch_size': 16}. Best is trial 151 with value: 0.4149248242378235.
[I 2026-03-01 22:37:24,576] Trial 175 finished with value: 0.4595575273036957 and parameters: {'n_layers': 2, 'hidden_dim': 16, 'dropout': 0.5, 'activation': 'Tanh', 'lr': 0.008960581169367543, 'weight_decay': 0.004586495866022797, 'batch_size': 16}. Best is trial 151 with value: 0.4149248242378235.
[I 2026-03-01 22:37:26,973] Trial 176 finished with value: 0.45447511076927183 and parameters: {'n_layers': 2, 'hidden_dim': 64, 'dropout': 0.5, 'activation': 'Tanh', 'lr': 0.001337296637970226, 'weight_decay': 0.003835461595141363, 'batch_size': 16}. Best is trial 151 with value: 0.4149248242378235.
[I 2026-03-01 22:37:28,886] Trial 177 finished with value: 0.4485136568546295 and parameters: {'n_layers': 2, 'hidden_dim': 64, 'dropout': 0.5, 'activation': 'Tanh', 'lr': 0.002143689021477883, 'weight_decay': 0.006218328275331527, 'batch_size': 16}. Best is trial 151 with value: 0.4149248242378235.
[I 2026-03-01 22:37:31,249] Trial 178 finished with value: 0.424768853187561 and parameters: {'n_layers': 2, 'hidden_dim': 64, 'dropout': 0.5, 'activation': 'Tanh', 'lr': 0.008206075243667335, 'weight_decay': 0.008752564243165867, 'batch_size': 16}. Best is trial 151 with value: 0.4149248242378235.
[I 2026-03-01 22:37:33,600] Trial 179 finished with value: 0.4202752888202667 and parameters: {'n_layers': 2, 'hidden_dim': 64, 'dropout': 0.5, 'activation': 'Tanh', 'lr': 0.007306066988066428, 'weight_decay': 0.005066493637981999, 'batch_size': 16}. Best is trial 151 with value: 0.4149248242378235.
[I 2026-03-01 22:37:35,915] Trial 180 finished with value: 0.4271768510341644 and parameters: {'n_layers': 2, 'hidden_dim': 64, 'dropout': 0.5, 'activation': 'Tanh', 'lr': 0.0060608206756380565, 'weight_decay': 0.0051585815210128255, 'batch_size': 16}. Best is trial 151 with value: 0.4149248242378235.
[I 2026-03-01 22:37:37,504] Trial 181 finished with value: 0.4279833436012268 and parameters: {'n_layers': 2, 'hidden_dim': 64, 'dropout': 0.5, 'activation': 'Tanh', 'lr': 0.007180174186858372, 'weight_decay': 0.007130338138553802, 'batch_size': 16}. Best is trial 151 with value: 0.4149248242378235.
[I 2026-03-01 22:37:39,152] Trial 182 finished with value: 0.42135889530181886 and parameters: {'n_layers': 2, 'hidden_dim': 64, 'dropout': 0.5, 'activation': 'Tanh', 'lr': 0.009078941785270087, 'weight_decay': 0.005950197961415776, 'batch_size': 16}. Best is trial 151 with value: 0.4149248242378235.
[I 2026-03-01 22:37:40,691] Trial 183 finished with value: 0.42081003785133364 and parameters: {'n_layers': 2, 'hidden_dim': 64, 'dropout': 0.5, 'activation': 'Tanh', 'lr': 0.007825109910327963, 'weight_decay': 0.004287252437918996, 'batch_size': 16}. Best is trial 151 with value: 0.4149248242378235.
[I 2026-03-01 22:37:42,240] Trial 184 finished with value: 0.4214196503162384 and parameters: {'n_layers': 2, 'hidden_dim': 64, 'dropout': 0.5, 'activation': 'Tanh', 'lr': 0.007672336255400263, 'weight_decay': 0.004177840584237212, 'batch_size': 16}. Best is trial 151 with value: 0.4149248242378235.
[I 2026-03-01 22:37:43,284] Trial 185 finished with value: 0.44893341660499575 and parameters: {'n_layers': 2, 'hidden_dim': 64, 'dropout': 0.5, 'activation': 'Tanh', 'lr': 0.007471588649034993, 'weight_decay': 0.004161954360364335, 'batch_size': 32}. Best is trial 151 with value: 0.4149248242378235.
[I 2026-03-01 22:37:44,968] Trial 186 finished with value: 0.42731097936630247 and parameters: {'n_layers': 2, 'hidden_dim': 64, 'dropout': 0.5, 'activation': 'Tanh', 'lr': 0.006789651254883715, 'weight_decay': 0.0036425902302452146, 'batch_size': 16}. Best is trial 151 with value: 0.4149248242378235.
[I 2026-03-01 22:37:46,314] Trial 187 finished with value: 0.4546487510204315 and parameters: {'n_layers': 2, 'hidden_dim': 64, 'dropout': 0.5, 'activation': 'LeakyReLU', 'lr': 0.007853772548535615, 'weight_decay': 0.004852410419787505, 'batch_size': 16}. Best is trial 151 with value: 0.4149248242378235.
[I 2026-03-01 22:37:48,549] Trial 188 finished with value: 0.42534652948379514 and parameters: {'n_layers': 2, 'hidden_dim': 64, 'dropout': 0.5, 'activation': 'Tanh', 'lr': 0.006177248139085338, 'weight_decay': 0.004387041330790094, 'batch_size': 16}. Best is trial 151 with value: 0.4149248242378235.
[I 2026-03-01 22:37:50,354] Trial 189 finished with value: 0.423874694108963 and parameters: {'n_layers': 2, 'hidden_dim': 64, 'dropout': 0.5, 'activation': 'Tanh', 'lr': 0.007098532083082085, 'weight_decay': 0.005562923373853768, 'batch_size': 16}. Best is trial 151 with value: 0.4149248242378235.
[I 2026-03-01 22:37:51,987] Trial 190 finished with value: 0.421260792016983 and parameters: {'n_layers': 2, 'hidden_dim': 64, 'dropout': 0.5, 'activation': 'Tanh', 'lr': 0.008277527096930807, 'weight_decay': 0.003324478849419588, 'batch_size': 16}. Best is trial 151 with value: 0.4149248242378235.
[I 2026-03-01 22:37:53,515] Trial 191 finished with value: 0.4249478101730347 and parameters: {'n_layers': 2, 'hidden_dim': 64, 'dropout': 0.5, 'activation': 'Tanh', 'lr': 0.008325675871220089, 'weight_decay': 0.0033294209930033085, 'batch_size': 16}. Best is trial 151 with value: 0.4149248242378235.
[I 2026-03-01 22:37:55,101] Trial 192 finished with value: 0.4225186347961426 and parameters: {'n_layers': 2, 'hidden_dim': 64, 'dropout': 0.5, 'activation': 'Tanh', 'lr': 0.007795913525485797, 'weight_decay': 0.0036854532418712366, 'batch_size': 16}. Best is trial 151 with value: 0.4149248242378235.
[I 2026-03-01 22:37:56,803] Trial 193 finished with value: 0.41962385177612305 and parameters: {'n_layers': 2, 'hidden_dim': 64, 'dropout': 0.5, 'activation': 'Tanh', 'lr': 0.008597211919639698, 'weight_decay': 0.004126684739644344, 'batch_size': 16}. Best is trial 151 with value: 0.4149248242378235.
[I 2026-03-01 22:37:58,307] Trial 194 finished with value: 0.4231170952320099 and parameters: {'n_layers': 2, 'hidden_dim': 64, 'dropout': 0.5, 'activation': 'Tanh', 'lr': 0.00864951439784218, 'weight_decay': 0.0050996320778347575, 'batch_size': 16}. Best is trial 151 with value: 0.4149248242378235.
[I 2026-03-01 22:38:00,010] Trial 195 finished with value: 0.42251467108726504 and parameters: {'n_layers': 2, 'hidden_dim': 64, 'dropout': 0.5, 'activation': 'Tanh', 'lr': 0.008720417565524352, 'weight_decay': 0.006070662755000736, 'batch_size': 16}. Best is trial 151 with value: 0.4149248242378235.
[I 2026-03-01 22:38:01,194] Trial 196 finished with value: 0.4763587176799774 and parameters: {'n_layers': 2, 'hidden_dim': 64, 'dropout': 0.5, 'activation': 'ReLU', 'lr': 0.007111889132874386, 'weight_decay': 0.002064761686139422, 'batch_size': 16}. Best is trial 151 with value: 0.4149248242378235.
[I 2026-03-01 22:38:02,872] Trial 197 finished with value: 0.41829587817192077 and parameters: {'n_layers': 2, 'hidden_dim': 64, 'dropout': 0.5, 'activation': 'Tanh', 'lr': 0.008339376678370192, 'weight_decay': 0.004797579873624481, 'batch_size': 16}. Best is trial 151 with value: 0.4149248242378235.
[I 2026-03-01 22:38:04,633] Trial 198 finished with value: 0.4244821906089783 and parameters: {'n_layers': 2, 'hidden_dim': 64, 'dropout': 0.5, 'activation': 'Tanh', 'lr': 0.00911277682788578, 'weight_decay': 0.0056387519465317245, 'batch_size': 16}. Best is trial 151 with value: 0.4149248242378235.
