[I 2026-03-01 22:38:06,551] Trial 199 finished with value: 0.48607889413833616 and parameters: {'n_layers': 2, 'hidden_dim': 8, 'dropout': 0.5, 'activation': 'Tanh', 'lr': 0.008231569250427813, 'weight_decay': 0.004378714936264838, 'batch_size': 16}. Best is trial 151 with value: 0.4149248242378235.

============================================================
Best trial
============================================================
  CV MSE (Scaled): 0.4149
  n_layers: 2
  hidden_dim: 64
  dropout: 0.5
  activation: Tanh
  lr: 0.00831608810326909
  weight_decay: 0.004335006601375103
  batch_size: 16

============================================================
Final retrain on full training set ...
============================================================
  Determining optimal epoch count from CV ...
  Fold best epochs: [2, 34, 13, 158, 109]  →  median = 34
  Trained for 34 epochs on all 141 training samples

============================================================
Final evaluation on test set (original scale)
============================================================
  T_THMs_ug_L      RMSE=  7.971  MAE=  6.262  R²=0.3921
  DBCM_ug_L        RMSE=  2.950  MAE=  2.461  R²=0.4219
  BDCM_ug_L        RMSE=  1.767  MAE=  1.384  R²=0.2724

Model saved to mlp_tuned_checkpoint.pt
[I 2026-03-01 22:32:04,642] A new study created in memory with name: no-name-ad32a389-a22b-459e-85e7-ef38a82a4835

  0%|          | 0/200 [00:00<?, ?it/s]
                                       

  0%|          | 0/200 [00:10<?, ?it/s]
Best trial: 0. Best value: 0.528166:   0%|          | 0/200 [00:10<?, ?it/s]
Best trial: 0. Best value: 0.528166:   0%|          | 1/200 [00:10<35:04, 10.57s/it]
                                                                                    

Best trial: 0. Best value: 0.528166:   0%|          | 1/200 [00:12<35:04, 10.57s/it]
Best trial: 1. Best value: 0.488147:   0%|          | 1/200 [00:12<35:04, 10.57s/it]
Best trial: 1. Best value: 0.488147:   1%|          | 2/200 [00:12<19:02,  5.77s/it]
                                                                                    

Best trial: 1. Best value: 0.488147:   1%|          | 2/200 [00:16<19:02,  5.77s/it]
Best trial: 2. Best value: 0.483116:   1%|          | 2/200 [00:16<19:02,  5.77s/it]
Best trial: 2. Best value: 0.483116:   2%|▏         | 3/200 [00:16<16:08,  4.92s/it]
                                                                                    

Best trial: 2. Best value: 0.483116:   2%|▏         | 3/200 [00:18<16:08,  4.92s/it]
Best trial: 2. Best value: 0.483116:   2%|▏         | 3/200 [00:18<16:08,  4.92s/it]
Best trial: 2. Best value: 0.483116:   2%|▏         | 4/200 [00:18<12:21,  3.78s/it]
                                                                                    

Best trial: 2. Best value: 0.483116:   2%|▏         | 4/200 [00:19<12:21,  3.78s/it]
Best trial: 4. Best value: 0.461043:   2%|▏         | 4/200 [00:19<12:21,  3.78s/it]
Best trial: 4. Best value: 0.461043:   2%|▎         | 5/200 [00:19<09:04,  2.79s/it]
                                                                                    

Best trial: 4. Best value: 0.461043:   2%|▎         | 5/200 [00:29<09:04,  2.79s/it]
Best trial: 4. Best value: 0.461043:   2%|▎         | 5/200 [00:29<09:04,  2.79s/it]
Best trial: 4. Best value: 0.461043:   3%|▎         | 6/200 [00:29<16:49,  5.20s/it]
                                                                                    

Best trial: 4. Best value: 0.461043:   3%|▎         | 6/200 [00:30<16:49,  5.20s/it]
Best trial: 4. Best value: 0.461043:   3%|▎         | 6/200 [00:30<16:49,  5.20s/it]
Best trial: 4. Best value: 0.461043:   4%|▎         | 7/200 [00:30<12:13,  3.80s/it]
                                                                                    

Best trial: 4. Best value: 0.461043:   4%|▎         | 7/200 [00:31<12:13,  3.80s/it]
Best trial: 4. Best value: 0.461043:   4%|▎         | 7/200 [00:31<12:13,  3.80s/it]
Best trial: 4. Best value: 0.461043:   4%|▍         | 8/200 [00:31<08:52,  2.78s/it]
                                                                                    

Best trial: 4. Best value: 0.461043:   4%|▍         | 8/200 [00:32<08:52,  2.78s/it]
Best trial: 4. Best value: 0.461043:   4%|▍         | 8/200 [00:32<08:52,  2.78s/it]
Best trial: 4. Best value: 0.461043:   4%|▍         | 9/200 [00:32<07:10,  2.26s/it]
                                                                                    

Best trial: 4. Best value: 0.461043:   4%|▍         | 9/200 [00:38<07:10,  2.26s/it]
Best trial: 4. Best value: 0.461043:   4%|▍         | 9/200 [00:38<07:10,  2.26s/it]
Best trial: 4. Best value: 0.461043:   5%|▌         | 10/200 [00:38<11:16,  3.56s/it]
                                                                                     

Best trial: 4. Best value: 0.461043:   5%|▌         | 10/200 [00:41<11:16,  3.56s/it]
Best trial: 10. Best value: 0.459041:   5%|▌         | 10/200 [00:41<11:16,  3.56s/it]
Best trial: 10. Best value: 0.459041:   6%|▌         | 11/200 [00:41<09:59,  3.17s/it]
                                                                                      

Best trial: 10. Best value: 0.459041:   6%|▌         | 11/200 [00:43<09:59,  3.17s/it]
Best trial: 11. Best value: 0.458555:   6%|▌         | 11/200 [00:43<09:59,  3.17s/it]
Best trial: 11. Best value: 0.458555:   6%|▌         | 12/200 [00:43<09:07,  2.91s/it]
                                                                                      

Best trial: 11. Best value: 0.458555:   6%|▌         | 12/200 [00:45<09:07,  2.91s/it]
Best trial: 12. Best value: 0.458126:   6%|▌         | 12/200 [00:45<09:07,  2.91s/it]
Best trial: 12. Best value: 0.458126:   6%|▋         | 13/200 [00:45<08:27,  2.71s/it]
                                                                                      

Best trial: 12. Best value: 0.458126:   6%|▋         | 13/200 [00:48<08:27,  2.71s/it]
Best trial: 12. Best value: 0.458126:   6%|▋         | 13/200 [00:48<08:27,  2.71s/it]
Best trial: 12. Best value: 0.458126:   7%|▋         | 14/200 [00:48<08:18,  2.68s/it]
                                                                                      

Best trial: 12. Best value: 0.458126:   7%|▋         | 14/200 [00:50<08:18,  2.68s/it]
Best trial: 14. Best value: 0.453746:   7%|▋         | 14/200 [00:50<08:18,  2.68s/it]
Best trial: 14. Best value: 0.453746:   8%|▊         | 15/200 [00:50<08:08,  2.64s/it]
                                                                                      

Best trial: 14. Best value: 0.453746:   8%|▊         | 15/200 [00:54<08:08,  2.64s/it]
Best trial: 15. Best value: 0.4469:   8%|▊         | 15/200 [00:54<08:08,  2.64s/it]  
Best trial: 15. Best value: 0.4469:   8%|▊         | 16/200 [00:54<08:51,  2.89s/it]
                                                                                    

Best trial: 15. Best value: 0.4469:   8%|▊         | 16/200 [00:56<08:51,  2.89s/it]
Best trial: 16. Best value: 0.445727:   8%|▊         | 16/200 [00:56<08:51,  2.89s/it]
Best trial: 16. Best value: 0.445727:   8%|▊         | 17/200 [00:56<07:42,  2.53s/it]
                                                                                      

Best trial: 16. Best value: 0.445727:   8%|▊         | 17/200 [00:57<07:42,  2.53s/it]
Best trial: 16. Best value: 0.445727:   8%|▊         | 17/200 [00:57<07:42,  2.53s/it]
Best trial: 16. Best value: 0.445727:   9%|▉         | 18/200 [00:57<06:58,  2.30s/it]
                                                                                      

Best trial: 16. Best value: 0.445727:   9%|▉         | 18/200 [01:00<06:58,  2.30s/it]
Best trial: 16. Best value: 0.445727:   9%|▉         | 18/200 [01:00<06:58,  2.30s/it]
Best trial: 16. Best value: 0.445727:  10%|▉         | 19/200 [01:00<06:49,  2.26s/it]
                                                                                      

Best trial: 16. Best value: 0.445727:  10%|▉         | 19/200 [01:01<06:49,  2.26s/it]
Best trial: 16. Best value: 0.445727:  10%|▉         | 19/200 [01:01<06:49,  2.26s/it]
Best trial: 16. Best value: 0.445727:  10%|█         | 20/200 [01:01<06:24,  2.14s/it]
                                                                                      

Best trial: 16. Best value: 0.445727:  10%|█         | 20/200 [01:03<06:24,  2.14s/it]
Best trial: 16. Best value: 0.445727:  10%|█         | 20/200 [01:03<06:24,  2.14s/it]
Best trial: 16. Best value: 0.445727:  10%|█         | 21/200 [01:03<05:31,  1.85s/it]
                                                                                      

Best trial: 16. Best value: 0.445727:  10%|█         | 21/200 [01:04<05:31,  1.85s/it]
Best trial: 21. Best value: 0.445638:  10%|█         | 21/200 [01:04<05:31,  1.85s/it]
Best trial: 21. Best value: 0.445638:  11%|█         | 22/200 [01:04<05:20,  1.80s/it]
                                                                                      

Best trial: 21. Best value: 0.445638:  11%|█         | 22/200 [01:06<05:20,  1.80s/it]
Best trial: 21. Best value: 0.445638:  11%|█         | 22/200 [01:06<05:20,  1.80s/it]
Best trial: 21. Best value: 0.445638:  12%|█▏        | 23/200 [01:06<05:17,  1.79s/it]
                                                                                      

Best trial: 21. Best value: 0.445638:  12%|█▏        | 23/200 [01:09<05:17,  1.79s/it]
Best trial: 21. Best value: 0.445638:  12%|█▏        | 23/200 [01:09<05:17,  1.79s/it]
Best trial: 21. Best value: 0.445638:  12%|█▏        | 24/200 [01:09<06:04,  2.07s/it]
                                                                                      

Best trial: 21. Best value: 0.445638:  12%|█▏        | 24/200 [01:11<06:04,  2.07s/it]
Best trial: 21. Best value: 0.445638:  12%|█▏        | 24/200 [01:11<06:04,  2.07s/it]
Best trial: 21. Best value: 0.445638:  12%|█▎        | 25/200 [01:11<06:14,  2.14s/it]
                                                                                      

Best trial: 21. Best value: 0.445638:  12%|█▎        | 25/200 [01:12<06:14,  2.14s/it]
Best trial: 25. Best value: 0.443972:  12%|█▎        | 25/200 [01:12<06:14,  2.14s/it]
Best trial: 25. Best value: 0.443972:  13%|█▎        | 26/200 [01:12<05:34,  1.92s/it]
                                                                                      

Best trial: 25. Best value: 0.443972:  13%|█▎        | 26/200 [01:14<05:34,  1.92s/it]
Best trial: 25. Best value: 0.443972:  13%|█▎        | 26/200 [01:14<05:34,  1.92s/it]
Best trial: 25. Best value: 0.443972:  14%|█▎        | 27/200 [01:14<05:03,  1.76s/it]
                                                                                      

Best trial: 25. Best value: 0.443972:  14%|█▎        | 27/200 [01:15<05:03,  1.76s/it]
Best trial: 25. Best value: 0.443972:  14%|█▎        | 27/200 [01:15<05:03,  1.76s/it]
Best trial: 25. Best value: 0.443972:  14%|█▍        | 28/200 [01:15<04:52,  1.70s/it]
                                                                                      

Best trial: 25. Best value: 0.443972:  14%|█▍        | 28/200 [01:19<04:52,  1.70s/it]
Best trial: 25. Best value: 0.443972:  14%|█▍        | 28/200 [01:19<04:52,  1.70s/it]
Best trial: 25. Best value: 0.443972:  14%|█▍        | 29/200 [01:19<06:04,  2.13s/it]
                                                                                      

Best trial: 25. Best value: 0.443972:  14%|█▍        | 29/200 [01:20<06:04,  2.13s/it]
Best trial: 25. Best value: 0.443972:  14%|█▍        | 29/200 [01:20<06:04,  2.13s/it]
Best trial: 25. Best value: 0.443972:  15%|█▌        | 30/200 [01:20<05:18,  1.87s/it]
                                                                                      

Best trial: 25. Best value: 0.443972:  15%|█▌        | 30/200 [01:22<05:18,  1.87s/it]
Best trial: 30. Best value: 0.44244:  15%|█▌        | 30/200 [01:22<05:18,  1.87s/it] 
Best trial: 30. Best value: 0.44244:  16%|█▌        | 31/200 [01:22<05:19,  1.89s/it]
                                                                                     

Best trial: 30. Best value: 0.44244:  16%|█▌        | 31/200 [01:24<05:19,  1.89s/it]
Best trial: 30. Best value: 0.44244:  16%|█▌        | 31/200 [01:24<05:19,  1.89s/it]
Best trial: 30. Best value: 0.44244:  16%|█▌        | 32/200 [01:24<05:17,  1.89s/it]
                                                                                     

Best trial: 30. Best value: 0.44244:  16%|█▌        | 32/200 [01:26<05:17,  1.89s/it]
Best trial: 30. Best value: 0.44244:  16%|█▌        | 32/200 [01:26<05:17,  1.89s/it]
Best trial: 30. Best value: 0.44244:  16%|█▋        | 33/200 [01:26<05:13,  1.88s/it]
                                                                                     

Best trial: 30. Best value: 0.44244:  16%|█▋        | 33/200 [01:27<05:13,  1.88s/it]
Best trial: 33. Best value: 0.43868:  16%|█▋        | 33/200 [01:27<05:13,  1.88s/it]
Best trial: 33. Best value: 0.43868:  17%|█▋        | 34/200 [01:27<05:14,  1.89s/it]
                                                                                     

Best trial: 33. Best value: 0.43868:  17%|█▋        | 34/200 [01:29<05:14,  1.89s/it]
Best trial: 33. Best value: 0.43868:  17%|█▋        | 34/200 [01:29<05:14,  1.89s/it]
Best trial: 33. Best value: 0.43868:  18%|█▊        | 35/200 [01:29<04:52,  1.77s/it]
                                                                                     

Best trial: 33. Best value: 0.43868:  18%|█▊        | 35/200 [01:30<04:52,  1.77s/it]
Best trial: 33. Best value: 0.43868:  18%|█▊        | 35/200 [01:30<04:52,  1.77s/it]
Best trial: 33. Best value: 0.43868:  18%|█▊        | 36/200 [01:30<04:08,  1.52s/it]
                                                                                     

Best trial: 33. Best value: 0.43868:  18%|█▊        | 36/200 [01:34<04:08,  1.52s/it]
Best trial: 33. Best value: 0.43868:  18%|█▊        | 36/200 [01:34<04:08,  1.52s/it]
Best trial: 33. Best value: 0.43868:  18%|█▊        | 37/200 [01:34<05:58,  2.20s/it]
                                                                                     

Best trial: 33. Best value: 0.43868:  18%|█▊        | 37/200 [01:35<05:58,  2.20s/it]
Best trial: 33. Best value: 0.43868:  18%|█▊        | 37/200 [01:35<05:58,  2.20s/it]
Best trial: 33. Best value: 0.43868:  19%|█▉        | 38/200 [01:35<05:14,  1.94s/it]
                                                                                     

Best trial: 33. Best value: 0.43868:  19%|█▉        | 38/200 [01:39<05:14,  1.94s/it]
Best trial: 33. Best value: 0.43868:  19%|█▉        | 38/200 [01:39<05:14,  1.94s/it]
Best trial: 33. Best value: 0.43868:  20%|█▉        | 39/200 [01:39<07:17,  2.72s/it]
                                                                                     

Best trial: 33. Best value: 0.43868:  20%|█▉        | 39/200 [01:42<07:17,  2.72s/it]
Best trial: 33. Best value: 0.43868:  20%|█▉        | 39/200 [01:42<07:17,  2.72s/it]
Best trial: 33. Best value: 0.43868:  20%|██        | 40/200 [01:42<06:59,  2.62s/it]
                                                                                     

Best trial: 33. Best value: 0.43868:  20%|██        | 40/200 [01:43<06:59,  2.62s/it]
Best trial: 33. Best value: 0.43868:  20%|██        | 40/200 [01:43<06:59,  2.62s/it]
Best trial: 33. Best value: 0.43868:  20%|██        | 41/200 [01:43<05:58,  2.26s/it]
                                                                                     

Best trial: 33. Best value: 0.43868:  20%|██        | 41/200 [01:44<05:58,  2.26s/it]
Best trial: 33. Best value: 0.43868:  20%|██        | 41/200 [01:44<05:58,  2.26s/it]
Best trial: 33. Best value: 0.43868:  21%|██        | 42/200 [01:44<04:51,  1.84s/it]
                                                                                     

Best trial: 33. Best value: 0.43868:  21%|██        | 42/200 [01:45<04:51,  1.84s/it]
Best trial: 33. Best value: 0.43868:  21%|██        | 42/200 [01:45<04:51,  1.84s/it]
Best trial: 33. Best value: 0.43868:  22%|██▏       | 43/200 [01:45<03:58,  1.52s/it]
                                                                                     

Best trial: 33. Best value: 0.43868:  22%|██▏       | 43/200 [01:46<03:58,  1.52s/it]
Best trial: 33. Best value: 0.43868:  22%|██▏       | 43/200 [01:46<03:58,  1.52s/it]
Best trial: 33. Best value: 0.43868:  22%|██▏       | 44/200 [01:46<03:57,  1.52s/it]
                                                                                     

Best trial: 33. Best value: 0.43868:  22%|██▏       | 44/200 [01:47<03:57,  1.52s/it]
Best trial: 33. Best value: 0.43868:  22%|██▏       | 44/200 [01:47<03:57,  1.52s/it]
Best trial: 33. Best value: 0.43868:  22%|██▎       | 45/200 [01:47<03:23,  1.32s/it]
                                                                                     

Best trial: 33. Best value: 0.43868:  22%|██▎       | 45/200 [01:49<03:23,  1.32s/it]
Best trial: 33. Best value: 0.43868:  22%|██▎       | 45/200 [01:49<03:23,  1.32s/it]
Best trial: 33. Best value: 0.43868:  23%|██▎       | 46/200 [01:49<03:22,  1.31s/it]
                                                                                     

Best trial: 33. Best value: 0.43868:  23%|██▎       | 46/200 [01:50<03:22,  1.31s/it]
Best trial: 33. Best value: 0.43868:  23%|██▎       | 46/200 [01:50<03:22,  1.31s/it]
Best trial: 33. Best value: 0.43868:  24%|██▎       | 47/200 [01:50<03:13,  1.27s/it]
                                                                                     

Best trial: 33. Best value: 0.43868:  24%|██▎       | 47/200 [01:52<03:13,  1.27s/it]
Best trial: 33. Best value: 0.43868:  24%|██▎       | 47/200 [01:52<03:13,  1.27s/it]
Best trial: 33. Best value: 0.43868:  24%|██▍       | 48/200 [01:52<03:56,  1.56s/it]
                                                                                     

Best trial: 33. Best value: 0.43868:  24%|██▍       | 48/200 [01:54<03:56,  1.56s/it]
Best trial: 33. Best value: 0.43868:  24%|██▍       | 48/200 [01:54<03:56,  1.56s/it]
Best trial: 33. Best value: 0.43868:  24%|██▍       | 49/200 [01:54<04:37,  1.84s/it]
                                                                                     

Best trial: 33. Best value: 0.43868:  24%|██▍       | 49/200 [01:58<04:37,  1.84s/it]
Best trial: 33. Best value: 0.43868:  24%|██▍       | 49/200 [01:58<04:37,  1.84s/it]
Best trial: 33. Best value: 0.43868:  25%|██▌       | 50/200 [01:58<05:56,  2.37s/it]
                                                                                     

Best trial: 33. Best value: 0.43868:  25%|██▌       | 50/200 [02:00<05:56,  2.37s/it]
Best trial: 33. Best value: 0.43868:  25%|██▌       | 50/200 [02:00<05:56,  2.37s/it]
Best trial: 33. Best value: 0.43868:  26%|██▌       | 51/200 [02:00<05:09,  2.08s/it]
                                                                                     

Best trial: 33. Best value: 0.43868:  26%|██▌       | 51/200 [02:01<05:09,  2.08s/it]
Best trial: 33. Best value: 0.43868:  26%|██▌       | 51/200 [02:01<05:09,  2.08s/it]
Best trial: 33. Best value: 0.43868:  26%|██▌       | 52/200 [02:01<04:47,  1.95s/it]
                                                                                     

Best trial: 33. Best value: 0.43868:  26%|██▌       | 52/200 [02:02<04:47,  1.95s/it]
Best trial: 33. Best value: 0.43868:  26%|██▌       | 52/200 [02:02<04:47,  1.95s/it]
Best trial: 33. Best value: 0.43868:  26%|██▋       | 53/200 [02:02<03:59,  1.63s/it]
                                                                                     

Best trial: 33. Best value: 0.43868:  26%|██▋       | 53/200 [02:03<03:59,  1.63s/it]
Best trial: 33. Best value: 0.43868:  26%|██▋       | 53/200 [02:03<03:59,  1.63s/it]
Best trial: 33. Best value: 0.43868:  27%|██▋       | 54/200 [02:03<03:46,  1.55s/it]
                                                                                     

Best trial: 33. Best value: 0.43868:  27%|██▋       | 54/200 [02:05<03:46,  1.55s/it]
Best trial: 33. Best value: 0.43868:  27%|██▋       | 54/200 [02:05<03:46,  1.55s/it]
Best trial: 33. Best value: 0.43868:  28%|██▊       | 55/200 [02:05<03:31,  1.46s/it]
                                                                                     

Best trial: 33. Best value: 0.43868:  28%|██▊       | 55/200 [02:06<03:31,  1.46s/it]
Best trial: 33. Best value: 0.43868:  28%|██▊       | 55/200 [02:06<03:31,  1.46s/it]
Best trial: 33. Best value: 0.43868:  28%|██▊       | 56/200 [02:06<03:15,  1.36s/it]
                                                                                     

Best trial: 33. Best value: 0.43868:  28%|██▊       | 56/200 [02:08<03:15,  1.36s/it]
Best trial: 33. Best value: 0.43868:  28%|██▊       | 56/200 [02:08<03:15,  1.36s/it]
Best trial: 33. Best value: 0.43868:  28%|██▊       | 57/200 [02:08<03:49,  1.61s/it]
                                                                                     

Best trial: 33. Best value: 0.43868:  28%|██▊       | 57/200 [02:10<03:49,  1.61s/it]
Best trial: 33. Best value: 0.43868:  28%|██▊       | 57/200 [02:10<03:49,  1.61s/it]
Best trial: 33. Best value: 0.43868:  29%|██▉       | 58/200 [02:10<04:02,  1.71s/it]
                                                                                     

Best trial: 33. Best value: 0.43868:  29%|██▉       | 58/200 [02:12<04:02,  1.71s/it]
Best trial: 33. Best value: 0.43868:  29%|██▉       | 58/200 [02:12<04:02,  1.71s/it]
Best trial: 33. Best value: 0.43868:  30%|██▉       | 59/200 [02:12<03:59,  1.70s/it]
                                                                                     

Best trial: 33. Best value: 0.43868:  30%|██▉       | 59/200 [02:14<03:59,  1.70s/it]
Best trial: 33. Best value: 0.43868:  30%|██▉       | 59/200 [02:14<03:59,  1.